[
  {
    "mpn":"LM317T",
    "title":"Регулятор напряжения 1.2–37В, 1.5A",
    "manufacturer":"STMicroelectronics",
    "description":"Adjustable Regulator LM317T",
    "package":"TO-220","packaging":"Tube",
    "regions":["EU","US"],
    "stock_total":61199,"lead_days":0,
    "price_min_rub":38.75,
    "image":"/ui/placeholder.svg"
  },
  {
    "mpn":"1N4148W-TP",
    "title":"Диод импульсный 0.15A/100V [SOD-123]",
    "manufacturer":"MCC",
    "description":"Switching diode 1N4148W-TP",
    "package":"SOD-123","packaging":"Tape",
    "regions":["EU","ASIA"],
    "stock_total":95841,"lead_days":0,
    "price_min_rub":1.02,
    "image":"/ui/placeholder.svg"
  }
]
